{
  "schemaVersion": 1,
  "year": 2026,
  "updatedAt": "2026-09-12T09:10:04.740Z",
  "releases": [
    {
      "id": "apple-release-1873987890",
      "type": "single",
      "title": "חוזר לעצמי",
      "artists": [
        "עדן חסון"
      ],
      "releaseDate": "2026-02-04",
      "language": "he",
      "genres": [],
      "popularity": null,
      "eligibility": {
        "artist": "עדן חסון",
        "isIsraeli": true,
        "monthlyListeners": 828214,
        "source": {
          "label": "Spotify · תצפית בדף האמן",
          "url": "https://open.spotify.com/artist/6uQl3gu1AIXyvqCAxnc2q4/",
          "checkedAt": "2026-09-11T21:31:11.169Z"
        }
      },
      "sources": [
        {
          "label": "Apple Music",
          "url": "https://music.apple.com/il/album/1873987890",
          "checkedAt": "2026-09-11T21:31:11.169Z"
        },
        {
          "label": "מידע על הריליס",
          "url": "https://www.youtube.com/watch?v=PaIAGZjPKA8",
          "checkedAt": "2026-09-11T21:31:11.169Z"
        }
      ]
    },
    {
      "id": "apple-release-1876888193",
      "type": "ep",
      "title": "Life Lately",
      "artists": [
        "אושר כהן"
      ],
      "releaseDate": "2026-02-16",
      "language": "he",
      "genres": [
        "פופ"
      ],
      "popularity": null,
      "eligibility": {
        "artist": "אושר כהן",
        "isIsraeli": true,
        "monthlyListeners": 806725,
        "source": {
          "label": "Spotify · תצפית בדף האמן",
          "url": "https://open.spotify.com/artist/2LUB7PhWK2j2obgSTeD3GN",
          "checkedAt": "2026-09-12T09:10:04.740Z"
        }
      },
      "sources": [
        {
          "label": "Apple Music",
          "url": "https://music.apple.com/il/album/1876888193",
          "checkedAt": "2026-09-12T09:10:04.740Z"
        },
        {
          "label": "הליקון ארומה · מידע על הריליס",
          "url": "https://heliconaroma.co.il/%D7%90%D7%95%D7%A9%D7%A8-%D7%9B%D7%94%D7%9F-life-lately-ep/",
          "checkedAt": "2026-09-12T09:10:04.740Z"
        }
      ]
    },
    {
      "id": "apple-release-1877927148",
      "type": "album",
      "title": "חלק מהנצח",
      "artists": [
        "עומר אדם"
      ],
      "releaseDate": "2026-02-19",
      "language": "he",
      "genres": [
        "פופ"
      ],
      "popularity": null,
      "eligibility": {
        "artist": "עומר אדם",
        "isIsraeli": true,
        "monthlyListeners": 1228431,
        "source": {
          "label": "Spotify · תצפית בדף האמן",
          "url": "https://open.spotify.com/artist/1IAEef07H0fd9aA8aUHUlL/",
          "checkedAt": "2026-09-11T21:31:11.169Z"
        }
      },
      "sources": [
        {
          "label": "Apple Music",
          "url": "https://music.apple.com/il/album/1877927148",
          "checkedAt": "2026-09-11T21:31:11.169Z"
        },
        {
          "label": "מידע על הריליס",
          "url": "https://www.mako.co.il/news-entertainment/2026_q1/Article-f2fbb55cc457c91026.htm",
          "checkedAt": "2026-09-11T21:31:11.169Z"
        }
      ]
    },
    {
      "id": "apple-release-1886466607",
      "type": "single",
      "title": "שיר לממ\"ד",
      "artists": [
        "אודיה"
      ],
      "releaseDate": "2026-03-24",
      "language": "he",
      "genres": [
        "פופ"
      ],
      "popularity": null,
      "eligibility": {
        "artist": "אודיה",
        "isIsraeli": true,
        "monthlyListeners": 770200,
        "source": {
          "label": "Spotify · תצפית בדף האמן",
          "url": "https://open.spotify.com/artist/28jEBK1RysfSUBHFofFflA/",
          "checkedAt": "2026-09-11T21:31:11.169Z"
        }
      },
      "sources": [
        {
          "label": "Apple Music",
          "url": "https://music.apple.com/il/album/1886466607",
          "checkedAt": "2026-09-11T21:31:11.169Z"
        },
        {
          "label": "מידע על הריליס",
          "url": "https://bagels.tv/%D7%90%D7%95%D7%93%D7%99%D7%94-%D7%A9%D7%99%D7%A8-%D7%9C%D7%9E%D7%9E%D7%93/",
          "checkedAt": "2026-09-11T21:31:11.169Z"
        }
      ]
    },
    {
      "id": "apple-release-1887323372",
      "type": "single",
      "title": "עושה שלום",
      "artists": [
        "מתן לוי",
        "עדן חסון"
      ],
      "releaseDate": "2026-03-24",
      "language": "he",
      "genres": [
        "פופ"
      ],
      "popularity": null,
      "eligibility": {
        "artist": "עדן חסון",
        "isIsraeli": true,
        "monthlyListeners": 828214,
        "source": {
          "label": "Spotify · תצפית בדף האמן",
          "url": "https://open.spotify.com/artist/6uQl3gu1AIXyvqCAxnc2q4/",
          "checkedAt": "2026-09-11T21:31:11.169Z"
        }
      },
      "sources": [
        {
          "label": "Apple Music",
          "url": "https://music.apple.com/il/album/1887323372",
          "checkedAt": "2026-09-11T21:31:11.169Z"
        },
        {
          "label": "מידע על הריליס",
          "url": "https://yosmusic.com/%D7%A2%D7%93%D7%9F-%D7%97%D7%A1%D7%95%D7%9F-%D7%95%D7%9E%D7%AA%D7%9F-%D7%9C%D7%95%D7%99-%D7%A2%D7%95%D7%A9%D7%94-%D7%A9%D7%9C%D7%95%D7%9D/",
          "checkedAt": "2026-09-11T21:31:11.169Z"
        }
      ]
    },
    {
      "id": "apple-release-1896459483",
      "type": "single",
      "title": "כל הברכה שלי",
      "artists": [
        "עדן חסון"
      ],
      "releaseDate": "2026-05-10",
      "language": "he",
      "genres": [],
      "popularity": null,
      "eligibility": {
        "artist": "עדן חסון",
        "isIsraeli": true,
        "monthlyListeners": 828214,
        "source": {
          "label": "Spotify · תצפית בדף האמן",
          "url": "https://open.spotify.com/artist/6uQl3gu1AIXyvqCAxnc2q4/",
          "checkedAt": "2026-09-11T21:31:11.169Z"
        }
      },
      "sources": [
        {
          "label": "Apple Music",
          "url": "https://music.apple.com/il/album/1896459483",
          "checkedAt": "2026-09-11T21:31:11.169Z"
        },
        {
          "label": "מידע על הריליס",
          "url": "https://www.youtube.com/watch?v=xv6AXXmqWDA",
          "checkedAt": "2026-09-11T21:31:11.169Z"
        }
      ]
    },
    {
      "id": "apple-release-6768723548",
      "type": "single",
      "title": "איך שהיא רוקדת",
      "artists": [
        "עדן חסון",
        "אופק אדנק",
        "אגם בוחבוט"
      ],
      "releaseDate": "2026-05-19",
      "language": "he",
      "genres": [
        "פופ"
      ],
      "popularity": null,
      "eligibility": {
        "artist": "עדן חסון",
        "isIsraeli": true,
        "monthlyListeners": 828214,
        "source": {
          "label": "Spotify · תצפית בדף האמן",
          "url": "https://open.spotify.com/artist/6uQl3gu1AIXyvqCAxnc2q4/",
          "checkedAt": "2026-09-11T21:31:11.169Z"
        }
      },
      "sources": [
        {
          "label": "Apple Music",
          "url": "https://music.apple.com/il/album/6768723548",
          "checkedAt": "2026-09-11T21:31:11.169Z"
        },
        {
          "label": "מידע על הריליס",
          "url": "https://www.youtube.com/watch?v=eaqW5eQXTdM",
          "checkedAt": "2026-09-11T21:31:11.169Z"
        }
      ]
    },
    {
      "id": "apple-release-6769160540",
      "type": "single",
      "title": "Wedding Songs",
      "artists": [
        "אושר כהן"
      ],
      "releaseDate": "2026-05-17",
      "language": "he",
      "genres": [
        "פופ"
      ],
      "popularity": null,
      "eligibility": {
        "artist": "אושר כהן",
        "isIsraeli": true,
        "monthlyListeners": 806725,
        "source": {
          "label": "Spotify · תצפית בדף האמן",
          "url": "https://open.spotify.com/artist/2LUB7PhWK2j2obgSTeD3GN",
          "checkedAt": "2026-09-12T09:10:04.740Z"
        }
      },
      "sources": [
        {
          "label": "Apple Music",
          "url": "https://music.apple.com/il/album/6769160540",
          "checkedAt": "2026-09-12T09:10:04.740Z"
        },
        {
          "label": "הליקון ארומה · מידע על הריליס",
          "url": "https://heliconaroma.co.il/%D7%90%D7%95%D7%A9%D7%A8-%D7%9B%D7%94%D7%9F-wedding-song/",
          "checkedAt": "2026-09-12T09:10:04.740Z"
        }
      ]
    },
    {
      "id": "apple-release-6769335752",
      "type": "album",
      "title": "השם יעזור",
      "artists": [
        "אודיה"
      ],
      "releaseDate": "2026-05-17",
      "language": "he",
      "genres": [
        "פופ"
      ],
      "popularity": null,
      "eligibility": {
        "artist": "אודיה",
        "isIsraeli": true,
        "monthlyListeners": 770200,
        "source": {
          "label": "Spotify · תצפית בדף האמן",
          "url": "https://open.spotify.com/artist/28jEBK1RysfSUBHFofFflA/",
          "checkedAt": "2026-09-11T21:31:11.169Z"
        }
      },
      "sources": [
        {
          "label": "Apple Music",
          "url": "https://music.apple.com/il/album/6769335752",
          "checkedAt": "2026-09-11T21:31:11.169Z"
        },
        {
          "label": "מידע על הריליס",
          "url": "https://heliconaroma.co.il/%D7%90%D7%95%D7%93%D7%99%D7%94-%D7%94%D7%A9%D7%9D-%D7%99%D7%A2%D7%96%D7%95%D7%A8/",
          "checkedAt": "2026-09-11T21:31:11.169Z"
        }
      ]
    },
    {
      "id": "apple-release-6778542208",
      "type": "single",
      "title": "הלוואי שטוב לך",
      "artists": [
        "עדן חסון"
      ],
      "releaseDate": "2026-06-10",
      "language": "he",
      "genres": [],
      "popularity": null,
      "eligibility": {
        "artist": "עדן חסון",
        "isIsraeli": true,
        "monthlyListeners": 828214,
        "source": {
          "label": "Spotify · תצפית בדף האמן",
          "url": "https://open.spotify.com/artist/6uQl3gu1AIXyvqCAxnc2q4/",
          "checkedAt": "2026-09-11T21:31:11.169Z"
        }
      },
      "sources": [
        {
          "label": "Apple Music",
          "url": "https://music.apple.com/il/album/6778542208",